Hvor kjøper jeg billett?|Du kan kjøpe billet fra Vy.no, Vy Appen, Billettautomat, Betjent Stasjon, Narvesen, Ombord i Toget og hos Kundeservice|1|5|
Hvordan kjøper jeg periodebillett?|Det enkleste for deg er å kjøpe periodebilletten i appen. Vi tilbyr også periodebillett for Ruter, Kolumbus og Skyss. Enkelte varianter selger vi kun i appen. Du kan også kjøpe periodebillett på vy.no. Du kan ikke kjøpe periodebillett om bord. Du kan kjøpe setereservasjon som en tilleggstjeneste til din periodebillett i appen. Periodebilletten er personlig, og kan ikke benyttes av andre.|3|2|
Hvordan henter jeg billetter kjøpt på vy.no?|Det enkleste er å hente ut billetten via appen. Den kan også lastes ned som PDF eller hentes ut om bord, på billettautomat, på betjent stasjon og hos enkelte Narvesen-kiosker.|10|3|
Hva er reisekort?|Med reisekort reiser du med elektronisk billett hos Vy og Ruter, som samarbeider om kortsystemet elektronisk reisekort. Reisekortet gjelder i Oslo og Akershus. Du kan kjøpe reisekort fra kundeservice eller på betjent stasjon.|20|3|
Hvordan kjøper jeg gavekort?|Du kan ikke lenger kjøpe gavekort, men kunder kan få gavekort av oss i ulike sammenhenger.|3|10|
Jeg vil reise rundt i Norge i ferien. Finnes det en billett for dette?|Vi tilbyr ikke en fleksibel billett som kan brukes på flere avganger rundt omkring i Norge. Det er heller ikke mulig å reise med Interrailbillett i eget land. For å reise rundt i Norge med toget, må du dermed bestille enkeltbilletter for de avgangene du ønsker.|4|7|
Hvor lenge før avreise kan jeg kjøpe togbillett?|Billetter legges ut for salg 90 dager før avgang. Det kan være kortere salgsperiode ved planlagte arbeider på strekningen eller i forbindelse med ruteendringer i juni og desember.|32|7|